item,change
advanced_connectivity,"Пересобран продвинутый граф v135: коридоры ЖД/тракт/судоходные реки проверяются по локальной полосе общей границы, а не только по одной точке."
corridor_priority,"ЖД, исторические дороги и судоходные реки получили приоритет над болотным барьером; если судоходная река проходит через болота, ребро остается проходимым речным коридором."
wetlands,"Болота снимают связь только при отсутствии транспортного/речного коридора и при попадании центра общей границы в болото или покрытии >=80% контрольных точек."
highland,"Ограничение высот >400 м сохранено только севернее 50° с.ш.; южнее 50° слой высот не блокирует связь."
watersheds,"В качестве бассейнового барьера используются только главные водоразделы MAIN_BAS; коридор имеет приоритет над этим барьером."
visual,"SVG-ребра/узлы продвинутого графа оставлены под панелями интерфейса; версия обновлена до v135."
late_rail_overlay,"Для слоёв 1939–2021 дополнительно применён быстрый локальный ЖД-overlay по 5-км допуску к ребру, чтобы поздний железнодорожный каркас не занижался."
